{
  "v": 1,
  "task_id": "mana-core-storage-implementation-devstral-tools",
  "packet_sha256": "423d2ba1979763a10ab49989ced6616c4b2627038eeae4cf71322789e5f01ba1",
  "status": "done",
  "summary": "Implemented the bounded pure-Java mana storage slice and its executable test; independent verification passed 91 assertions.",
  "changed": [
    {
      "path": "src/main/java/com/manacore/core/storage/ChunkManaMap.java",
      "sha256": "271d57c7a5e19785f04bc5eed480e0cfed2a07cc62f8af7ee6bc6a63f53f7b87"
    },
    {
      "path": "src/main/java/com/manacore/core/storage/ManaCoordinates.java",
      "sha256": "08631969d094bb78dc6e594f8c2065c33894a712ebd18b7b0fa24aa018f5dbe5"
    },
    {
      "path": "src/main/java/com/manacore/core/ManaMath.java",
      "sha256": "6bd0f92e04e10aa938c2cb4ae2c24a12ac9eb74d1b4143b137235c571b4bc7eb"
    },
    {
      "path": "src/test/java/com/manacore/core/storage/ChunkManaMapTest.java",
      "sha256": "b6a674be8742e4a417ac6a07c821a5e8eb0e94603f6ebd01aa4f65a1f89f77f3"
    }
  ],
  "risks": [
    "This is a bounded pure-Java slice; Gradle, Fabric integration, and the full mod remain unimplemented and unverified."
  ]
}
