{
  "v": 1,
  "task_id": "mana-core-gradient-calculator-devstral",
  "packet_sha256": "975045a8da999fcbad6303cc605e25dbff87c9756cc3f1445621afbf94ccce77",
  "status": "done",
  "summary": "Devstral implemented the pure-Java GradientCalculator and executable tests. The controller removed malformed dead test helpers and corrected two argument-order expectations before the independent contract passed.",
  "changed": [
    {
      "path": "src/main/java/com/manacore/core/flow/GradientCalculator.java",
      "sha256": "07a905d5b3a15a27c99186fd604c4e1d63976c230d10330b14a30026012897ab"
    },
    {
      "path": "src/test/java/com/manacore/core/flow/GradientCalculatorTest.java",
      "sha256": "340b2a94342621a8318cb1ccd621a94612833aed04c88469cfdf288de0037003"
    }
  ],
  "risks": [
    "This remains a bounded pure-Java slice; Gradle, Fabric integration, and runtime behavior are not yet verified."
  ]
}
